{
  "schema_version": "evidence-intake/1.0.0",
  "bundle_id": "wb-bundle-0002",
  "produced_at": "2026-08-01T09:14:03Z",
  "jobspec_reference": {
    "schema_version": "jobspec-reference/1.0.0",
    "jobspec_id": "jb-2026-08-01-0007",
    "jobspec_digest": "6ca640d3f96b7f83944a1ca71ab02d0fb3552077dcf0195bc146fbf6120fe8d0",
    "jobspec_format_version": "2.4.0",
    "task_kind": "bug_fix",
    "retry_budget": 3,
    "declared_visible_test_command": "pytest tests/visible -q"
  },
  "attempts": [
    {
      "attempt_index": 0,
      "started_at": "2026-08-01T09:02:11Z",
      "ended_at": "2026-08-01T09:04:02Z",
      "outcome": "failed",
      "is_retry": false,
      "failure_class": "agent_error"
    },
    {
      "attempt_index": 1,
      "started_at": "2026-08-01T09:04:20Z",
      "ended_at": "2026-08-01T09:08:51Z",
      "outcome": "timed_out",
      "is_retry": true,
      "failure_class": "timeout"
    },
    {
      "attempt_index": 2,
      "started_at": "2026-08-01T09:09:05Z",
      "ended_at": "2026-08-01T09:13:52Z",
      "outcome": "succeeded",
      "is_retry": true
    }
  ],
  "visible_test_results": {
    "initial": {
      "command": "pytest tests/visible -q",
      "exit_code": 1,
      "total": 12,
      "passed": 10,
      "failed": 2,
      "errors": 0,
      "skipped": 0,
      "duration_seconds": 11.4,
      "report_sha256": "6abd6df359875cedb8874ca4502a97144fb918c687f01ad0f0c49d1f0cd03cf6",
      "collected_at": "2026-08-01T09:03:40Z"
    },
    "final": {
      "command": "pytest tests/visible -q",
      "exit_code": 0,
      "total": 12,
      "passed": 12,
      "failed": 0,
      "errors": 0,
      "skipped": 0,
      "duration_seconds": 11.4,
      "report_sha256": "f14a5edc62cf7939265f29628c5f55170a0a8f198204eed118f2ef4631e99708",
      "collected_at": "2026-08-01T09:13:20Z"
    }
  },
  "candidate_artifacts": [
    {
      "path": "candidate/ledger.py.diff",
      "media_type": "text/x-diff",
      "size_bytes": 279,
      "sha256": "fd350fbddf54545c010c82376c8e39d41e20d46b0709a60f9e6314ad57515b56",
      "entry_type": "file",
      "role": "patch"
    },
    {
      "path": "evidence/visible-tests-initial.json",
      "media_type": "application/json",
      "size_bytes": 90,
      "sha256": "6abd6df359875cedb8874ca4502a97144fb918c687f01ad0f0c49d1f0cd03cf6",
      "entry_type": "file",
      "role": "test_report"
    },
    {
      "path": "evidence/visible-tests-final.json",
      "media_type": "application/json",
      "size_bytes": 90,
      "sha256": "f14a5edc62cf7939265f29628c5f55170a0a8f198204eed118f2ef4631e99708",
      "entry_type": "file",
      "role": "test_report"
    }
  ],
  "narrative": {
    "trust_level": "untrusted",
    "agent_summary": "Third attempt. The first ran the wrong suite and the second exceeded its time budget; the retries are declared rather than collapsed into one run.",
    "reviewer_note": "Reviewed on the producing side. The lock scope looks right to me, but I did not run anything beyond the visible suite."
  },
  "redactions": [
    {
      "redaction_id": "red-0001",
      "location": "attempts[1] harness log",
      "rule_id": "bearer-token",
      "occurrences": 2,
      "replacement": "[REDACTED]"
    }
  ],
  "provenance": {
    "tool_name": "agent-workbench",
    "tool_version": "2.4.0",
    "workbench_commit": "4f2a9c1d7e6b8a0f3c5d2e1b9a8746f0c3b1d5e7",
    "environment_id": "wb-env-0091",
    "durable_execution": true
  },
  "manifest_digest": "fb2d69c6de401b0b2e9888ab09062bbc0e7c7918c82bba8292f8d2e2f9c30d23"
}
